{
  "id": "mw:provenance-activity:synthetic-run",
  "kind": "ProvenanceActivity",
  "schema_version": 1,
  "lifecycle": "candidate",
  "created_at": "2026-10-15T00:00:00Z",
  "updated_at": "2026-10-15T00:00:00Z",
  "origin_ref": "synthetic:fixture:activity",
  "visibility": "INTERNAL",
  "content_revision": 1
}
